{
  "episode_id": "ep.0002",
  "generated_at": "2026-10-10T12:00:00+00:00",
  "grader": {
    "kind": "ai",
    "model": "replay:grader_response_strong.json"
  },
  "learner": {
    "participant_id": "p.priya",
    "display_name": "Priya",
    "role": "nurse_practitioner_student"
  },
  "patient": {
    "record_id": "rec.maria-alvarez",
    "case_title": "58F type 2 diabetes, poor control, hidden non-adherence",
    "name": "Maria Alvarez",
    "age": 58,
    "sex": "female",
    "chief_complaint": "I'm thirsty all the time and I'm up all night going to the bathroom."
  },
  "encounter": {
    "duration_seconds": 543,
    "over_time_limit": false,
    "student_turn_count": 11
  },
  "rubric": {
    "total": 27,
    "max_total": 28,
    "needs_teacher_review": false,
    "review_reasons": [],
    "domains": [
      {
        "domain_id": "opening_and_purpose",
        "number": 1,
        "name": "Opening and purpose",
        "score": 4,
        "label": "Strong",
        "rationale": "You gave your name and role, said who you work with, laid out what the visit would cover, and asked her permission before starting.",
        "evidence": [
          {
            "turn_id": "t0",
            "quote": "I'd like to hear what's been going on, look at your chart with you, and make a plan together. Does that sound all right?",
            "turn_index": 0,
            "speaker": "learner"
          }
        ]
      },
      {
        "domain_id": "rapport_respect_empathy",
        "number": 2,
        "name": "Rapport, respect, and empathy",
        "score": 4,
        "label": "Strong",
        "rationale": "You named her fear and asked about it, and you took the blame out of the adherence conversation before she had to defend herself. She ended the visit relieved.",
        "evidence": [
          {
            "turn_id": "t14",
            "quote": "You look frightened. What are you most afraid of?",
            "turn_index": 14,
            "speaker": "learner"
          },
          {
            "turn_id": "t10",
            "quote": "I'm not trying to catch you out.",
            "turn_index": 10,
            "speaker": "learner"
          },
          {
            "turn_id": "t21",
            "quote": "Thank you for not making me feel bad.",
            "turn_index": 21,
            "speaker": "patient"
          }
        ]
      },
      {
        "domain_id": "information_gathering",
        "number": 3,
        "name": "Information gathering",
        "score": 4,
        "label": "Strong",
        "rationale": "Open, concrete questions throughout. You asked what gets in the way of the metformin instead of whether she takes it, and that brought out both the side effects and the cost.",
        "evidence": [
          {
            "turn_id": "t4",
            "quote": "What do you eat and drink from morning to night?",
            "turn_index": 4,
            "speaker": "learner"
          },
          {
            "turn_id": "t10",
            "quote": "What gets in the way for you?",
            "turn_index": 10,
            "speaker": "learner"
          }
        ]
      },
      {
        "domain_id": "listening_and_cues",
        "number": 4,
        "name": "Listening and response to cues",
        "score": 4,
        "label": "Strong",
        "rationale": "She looked away when she said the metformin was fine, and you checked the refill history instead of moving on. You also caught her fear the moment it showed.",
        "evidence": [
          {
            "turn_id": "t8",
            "quote": "I'm going to pull up your pharmacy refill history so I have the full picture.",
            "turn_index": 8,
            "speaker": "learner"
          },
          {
            "turn_id": "t14",
            "quote": "You look frightened.",
            "turn_index": 14,
            "speaker": "learner"
          }
        ]
      },
      {
        "domain_id": "explanation_and_shared_decisions",
        "number": 5,
        "name": "Explanation and shared decisions",
        "score": 3,
        "label": "Competent",
        "rationale": "You explained what an HbA1c is before ordering it, tied the result to her symptoms, and let her set her own goal for the sweet tea. You did not ask her to say back what the 9.2 percent means, so you cannot be sure it landed.",
        "evidence": [
          {
            "turn_id": "t12",
            "quote": "which shows your average sugar over the last three months",
            "turn_index": 12,
            "speaker": "learner"
          },
          {
            "turn_id": "t18",
            "quote": "What feels doable?",
            "turn_index": 18,
            "speaker": "learner"
          }
        ]
      },
      {
        "domain_id": "clinical_reasoning_and_synthesis",
        "number": 6,
        "name": "Clinical reasoning and synthesis",
        "score": 4,
        "label": "Strong",
        "rationale": "You connected the high HbA1c to missed doses and sugar intake instead of to a failing drug, and your handoff note states that reasoning clearly.",
        "evidence": [
          {
            "turn_id": "t16",
            "quote": "That's higher than we want, and it fits with the thirst.",
            "turn_index": 16,
            "speaker": "learner"
          },
          {
            "location": "handoff.assessment",
            "quote": "Poor control is explained by missed doses and sugar intake."
          }
        ]
      },
      {
        "domain_id": "professionalism_safety_closure",
        "number": 7,
        "name": "Professionalism, safety, and closure",
        "score": 4,
        "label": "Strong",
        "rationale": "You stayed within your role on the medication decision, summarised who would do what, set a follow-up, and invited questions.",
        "evidence": [
          {
            "turn_id": "t18",
            "quote": "I'll go over the options with Dr. Chen rather than promise something specific",
            "turn_index": 18,
            "speaker": "learner"
          },
          {
            "turn_id": "t20",
            "quote": "What questions do you have?",
            "turn_index": 20,
            "speaker": "learner"
          }
        ]
      }
    ]
  },
  "written_evidence": {
    "strength": {
      "text": "When the refill history contradicted her, you told her what it showed, said you were not trying to catch her out, and offered two ordinary reasons people struggle with metformin. That made it safe for her to tell you the truth.",
      "evidence": [
        {
          "turn_id": "t10",
          "quote": "Metformin is hard on a lot of people's stomachs, and it isn't cheap. What gets in the way for you?",
          "turn_index": 10,
          "speaker": "learner"
        }
      ]
    },
    "important_gap": {
      "text": "You gave her the HbA1c number and what it means but did not check her understanding. With low health literacy, asking her to tell you in her own words what the result means would confirm it.",
      "evidence": [
        {
          "turn_id": "t16",
          "quote": "Your HbA1c is 9.2 percent.",
          "turn_index": 16,
          "speaker": "learner"
        }
      ]
    },
    "safety_or_accuracy_concern": {
      "present": false,
      "text": "",
      "evidence": []
    }
  },
  "facts": {
    "elicited": [
      {
        "fact_id": "f.hpi.thirst",
        "label": "Thirst and urination",
        "value": "Increased thirst and nocturia for 3 months",
        "category": "history_of_present_illness",
        "channel": "patient",
        "turn_id": "t3",
        "turn_index": 3,
        "trigger": "asked when symptoms started"
      },
      {
        "fact_id": "f.sh.diet",
        "label": "Sweet tea",
        "value": "Drinks 4 to 5 large glasses of sweet tea a day",
        "category": "social_history",
        "channel": "patient",
        "turn_id": "t5",
        "turn_index": 5,
        "trigger": "asked about a typical day of eating and drinking"
      },
      {
        "fact_id": "f.med.refills",
        "label": "Metformin refill history",
        "value": "Pharmacy record shows 2 fills in the last 6 months",
        "category": "medication",
        "channel": "chart",
        "turn_id": "t8",
        "turn_index": 8,
        "trigger": "opened pharmacy refill history"
      },
      {
        "fact_id": "f.med.side_effects",
        "label": "Reason for skipped doses",
        "value": "Skips most doses because of diarrhoea and the cost of refills",
        "category": "medication",
        "channel": "patient",
        "turn_id": "t11",
        "turn_index": 11,
        "trigger": "asked non-judgmentally about side effects and cost"
      },
      {
        "fact_id": "f.lab.hba1c",
        "label": "HbA1c",
        "value": "9.2%",
        "category": "lab_result",
        "channel": "chart",
        "turn_id": "t12",
        "turn_index": 12,
        "trigger": "ordered HbA1c"
      },
      {
        "fact_id": "f.fh.mother",
        "label": "Mother's diabetes",
        "value": "Mother had type 2 diabetes and was on dialysis before she died",
        "category": "family_history",
        "channel": "patient",
        "turn_id": "t15",
        "turn_index": 15,
        "trigger": "asked what she is most afraid of"
      }
    ],
    "missed": []
  },
  "lies": [
    {
      "discrepancy_id": "d.adherence",
      "outcome": "uncovered",
      "evidence": [
        {
          "turn_id": "t7",
          "quote": "I take my metformin every day.",
          "turn_index": 7,
          "speaker": "patient"
        },
        {
          "turn_id": "t11",
          "quote": "I didn't want you to think I wasn't trying.",
          "turn_index": 11,
          "speaker": "patient"
        }
      ],
      "feedback": "She made the claim, you checked it, and she told you the truth once it was safe to.",
      "contradiction_was_visible": true,